issue_id,module_id,reported_by,report_date,category,severity,description,status,resolved_date,resolved_by
I001,M002,2,2023-02-10,Material,Medium,Incorrect material thickness in panel,Resolved,2023-02-12,4
I002,M003,6,2023-02-20,Assembly,High,Misaligned structural joints,Resolved,2023-02-23,1
I003,M004,2,2023-02-28,Electrical,Low,Loose electrical connection in outlet,Resolved,2023-03-01,4
I004,M005,6,2023-03-01,Finish,Medium,Paint defect on exterior wall,In Progress,,
I005,M008,2,2023-04-15,Plumbing,High,Water leak in bathroom fixture,Resolved,2023-04-18,4
I006,M009,6,2023-04-22,HVAC,Medium,Ventilation duct improperly sealed,In Progress,,
I007,M010,2,2023-03-01,Safety,Critical,Missing fire safety components,Resolved,2023-03-02,1
I008,M011,6,2023-03-08,Material,Low,Surface scratches on countertop,Resolved,2023-03-09,4
I009,M012,2,2023-03-12,Structural,High,Insufficient support beam reinforcement,In Progress,, 